{
  "protocolVersion": 1,
  "shotId": "shot_0JF2LSUI5jOQR7e6H3E2LuDTqz80Qwx8",
  "name": "Fixture Shot",
  "summary": "The same Shot after one public Evolution.",
  "platform": "IOS",
  "builder": {
    "role": "BUILDER",
    "method": "tohseno-local-test-v1",
    "id": "test_ZK37OkTgZ-bMwiS4GSo0GYK8taVtWFd5Vq58GfCbsxE"
  },
  "authority": {
    "identity": {
      "role": "BUILDER",
      "method": "tohseno-local-test-v1",
      "id": "test_ZK37OkTgZ-bMwiS4GSo0GYK8taVtWFd5Vq58GfCbsxE"
    },
    "suite": "ed25519-raw-v1",
    "keyId": "ed25519_To-bSIxYGppAM3Usdf5rFSm34YGWe3vKpERYyyIOu2A",
    "publicKey": "gJjRlxb0HD5bA8B2uk5Up-UuOo5qnBKetT6dKOtW7sw"
  },
  "lifecycle": "APP_STORE",
  "evolution": 1,
  "createdAt": "2026-07-25T00:00:00.000Z",
  "updatedAt": "2026-07-25T00:04:00.000Z",
  "latestRecordHash": "sha256:333ebd1260a84c2db26e7bac17f27def428c09890acafd6c7aba4f3e761877ee",
  "recordCount": 5,
  "evolutions": [
    {
      "evolution": 1,
      "title": "Canonical evolution",
      "summary": "The same Shot after one public Evolution.",
      "recordedAt": "2026-07-25T00:01:00.000Z",
      "recordHash": "sha256:b6e892423021602103e27963acfca40d82b40154e3f9815d85a92f82ae1207a2"
    }
  ],
  "appcoins": [
    {
      "link": {
        "deployment": {
          "namespace": "deployment-system",
          "id": "fixture-deployment"
        },
        "network": {
          "namespace": "network-family",
          "id": "fixture-network"
        },
        "asset": {
          "namespace": "asset-standard",
          "id": "fixture-asset"
        },
        "evidence": {
          "namespace": "public-receipt",
          "id": "fixture-receipt",
          "url": "https://evidence.example/fixture-receipt"
        }
      },
      "recordedAt": "2026-07-25T00:04:00.000Z",
      "recordHash": "sha256:333ebd1260a84c2db26e7bac17f27def428c09890acafd6c7aba4f3e761877ee"
    }
  ],
  "publication": {
    "source": {
      "url": "https://source.example/shots/canonical",
      "revision": "0123456789abcdef"
    },
    "download": {
      "url": "https://download.example/shots/canonical.zip",
      "artifactDigest": "sha256:aaaaaaaaaaaaaaaaaaaaaaaaaaaaaaaaaaaaaaaaaaaaaaaaaaaaaaaaaaaaaaaa",
      "manifestDigest": "sha256:bbbbbbbbbbbbbbbbbbbbbbbbbbbbbbbbbbbbbbbbbbbbbbbbbbbbbbbbbbbbbbbb"
    }
  },
  "appStore": {
    "listingId": "1234567890",
    "listingUrl": "https://apps.apple.com/us/app/fixture-shot/id1234567890"
  }
}
