{
  "protocolVersion": 1,
  "shotId": "shot_0JF2LSUI5jOQR7e6H3E2LuDTqz80Qwx8",
  "name": "Fixture Shot",
  "summary": "A deliberately public canonical protocol fixture.",
  "platform": "IOS",
  "builder": {
    "role": "BUILDER",
    "method": "tohseno-local-test-v1",
    "id": "test_ZK37OkTgZ-bMwiS4GSo0GYK8taVtWFd5Vq58GfCbsxE"
  },
  "authority": {
    "identity": {
      "role": "BUILDER",
      "method": "tohseno-local-test-v1",
      "id": "test_ZK37OkTgZ-bMwiS4GSo0GYK8taVtWFd5Vq58GfCbsxE"
    },
    "suite": "ed25519-raw-v1",
    "keyId": "ed25519_To-bSIxYGppAM3Usdf5rFSm34YGWe3vKpERYyyIOu2A",
    "publicKey": "gJjRlxb0HD5bA8B2uk5Up-UuOo5qnBKetT6dKOtW7sw"
  },
  "lifecycle": "EVOLVING",
  "evolution": 0,
  "createdAt": "2026-07-25T00:00:00.000Z",
  "updatedAt": "2026-07-25T00:00:00.000Z",
  "latestRecordHash": "sha256:940b2a89e11b5efa38fc92a7cf5633efd2493fbecf329384950b3489896f82aa",
  "recordCount": 1,
  "evolutions": [],
  "appcoins": []
}
